song,artist,dateRank,lyrics
Fifteen,Taylor Swift,"{'2010-01-09': 25, '2010-01-02': 30}","68 ContributorsTranslationsFrançaisEspañolPortuguêsFifteen Lyrics[Verse 1]
You take a deep breath and you walk through the doors
It's the mornin' of your very first day
You say ""hi"" to your friends you ain't seen in a while
Try and stay out of everybody's way
It's your freshman year and you're gonna be here
For the next four years in this town
Hopin' one of those senior boys will wink at you and say
""You know, I haven't seen you around before""

[Chorus]
'Cause when you're fifteen and somebody tells you they love you
You're gonna believe them
And when you're fifteen, feelin' like there's nothin' to figure out
Well, count to ten, take it in
This is life before you know who you're gonna be
Fifteen

[Verse 2]
You sit in class next to a redhead named Abigail
And soon enough, you're best friends
Laughin' at the other girls who think they're so cool
We'll be outta here as soon as we can
And then, you're on your very first date and he's got a car
And you're feelin' like flyin'
And your mama's waitin' up and you're thinkin' he's the one
And you're dancin' 'round your room when the night ends
When the night ends
See Taylor Swift LiveGet tickets as low as $61You might also like[Chorus]
'Cause when you're fifteen and somebody tells you they love you
You're gonna believe them
And when you're fifteen and your first kiss
Makes your head spin 'round
But in your life, you'll do things greater than
Dating the boy on the football team
But I didn't know it at fifteen

[Bridge]
When all you wanted was to be wanted
Wish you could go back and tell yourself what you know now
Back then, I swore I was gonna marry him someday
But I realized some bigger dreams of mine
And Abigail gave everything she had
To a boy who changed his mind
And we both cried

[Chorus]
'Cause when you're fifteen and somebody tells you they love you
You're gonna believe them
And when you're fifteen, don't forget to look before you fall
I've found time can heal most anything
And you just might find who you're supposed to be
I didn't know who I was supposed to be
At fifteen
[Post-Chorus]
La-la-la, la-la-la, la-la-la-la
La-la-la, la-la-la, la-la-la-la
La-la-la, la-la-la

[Outro]
Your very first day
Take a deep breath, girl
Take a deep breath as you walk through the doors43Embed"
Give It Up To Me,Shakira Featuring Lil Wayne,"{'2010-01-09': 40, '2010-01-02': 40}","25 ContributorsTranslationsEspañolGive It Up To Me Lyrics[Intro: Shakira & Timbaland]
How you doing?
I'm Mr. Mos', I'm back
Tim, are you on it?
Tim, are you on it?
Give me some
Is this what you wanted?
Is this what you wanted? Oh

[Verse 1: Lil Wayne]
I'm Wayne's World
I'm the cashier, I change girls
You can go up my crane, girl
And I'ma go down that drain, girl
Hey, uh, midnight cowboy
My flow is a dog, down, boy, ha
And my girl is a queen
And she do what I say, and I say what I mean
Then I give it to her uncut
Shakira swing them hips like nun-chucks
Now, give it to me
I want the best, and the best things in life are free

[Chorus: Shakira, Lil Wayne & Timbaland]
You can have it all
Anything you want you can make it yours
Anything you want in the world
Anything you want in the world
(Give it up to me)
Nothing too big or small
Anything you want you can make it yours
Anything you want in the world
Anything you want in the world
(Give it up to me)
You might also like[Verse 2: Shakira]
What you get is exactly what you give
Never really know until you try
We're so ahead of this
Got this she-wolf appetite
That keeps me up all night
You know the way it works
Don't be afraid to ask
Aim high when the target is low
F-Y-I, I am ready to go
People say men are just like kids
Never saw a kid behave like this
What you give is exactly what you receive

[Pre-Chorus: Shakira]
So put me in a cage and lock me away
And I'll play the games that you want me to play
Hey!

[Chorus: Shakira, Lil Wayne & Timbaland]
You can have it all
Anything you want you can make it yours
Anything you want in the world
Anything you want in the world
(Give it up to me)
Nothing too big or small
Anything you want you can make it yours
Anything you want in the world
Anything you want in the world
(Give it up to me)
[Bridge: Shakira & Lil Wayne]
Hey, can we go by walking
Do you prefer to fly?
All of the roads are open
In your mind, in your life
Give it up to me
Hey, can we go by walking
Do you prefer to fly?
All of the roads are open
In your life, in your life
Give it up to me

[Verse 3: Shakira, Timbaland, Both]
Hey, li’l lady, what's your plan?
Say, li’l mama, come take a ride, jump in
Hey, there, baby, what's on your mind?
Don't need approval tonight, tonight (Tonight)
Give it up

[Chorus: Shakira, Lil Wayne & Timbaland]
You can have it all
Anything you want you can make it yours
Anything you want in the world
Anything you want in the world
(Give it up to me)
Nothing too big or small
Anything you want you can make it yours
Anything you want in the world
Anything you want in the world
(Give it up to me)
You can have it all
Anything you want you can make it yours
Anything you want in the world
Anything you want in the world
(Give it up to me)
Nothing too big or small
Anything you want you can make it yours
Anything you want in the world
Anything you want in the world
(Give it up to me)5Embed"
Russian Roulette,Rihanna,"{'2010-01-09': 43, '2010-01-02': 53}","49 ContributorsTranslationsPortuguêsRussian Roulette Lyrics[Verse 1]
Take a breath, take it deep
""Calm yourself"", he says to me
If you play, you play for keeps
Take the gun and count to three
I'm sweating now, moving slow
No time to think, my turn to go

[Chorus]
And you can see my heart beating
You can see it through my chest
Said I'm terrified, but I'm not leaving
I know that I must pass this test
So just pull the trigger (Trigger, trigger, trigger)

[Verse 2]
Say a prayer to yourself
He says, ""Close your eyes
Sometimes it helps""
And then I get a scary thought
That he's here, means he's never lost

[Chorus]
And you can see my heart beating
Oh, you can see it through my chest
Said I'm terrified, but I'm not leaving
Know that I must pass this test
So just pull the trigger
You might also like[Bridge]
As my life flashes before my eyes
I'm wondering, will I ever see another sunrise?
So many won't get the chance to say goodbye
But it's too late to think of the value of my life

[Chorus]
And you can see my heart beating
No, woah, you can see it through my chest
Said I'm terrified but I'm not leaving, no
Know that I must pass this test
And you can see my heart beating
Oh, you can see it through my chest
Now I'm terrified, but I'm not leaving, no, no
Know that I must pass this test
So just pull the trigger (Trigger, trigger, trigger)45Embed"
Baby By Me,50 Cent Featuring Ne-Yo,"{'2010-01-09': 46, '2010-01-02': 36}","47 ContributorsBaby by Me Lyrics[Chorus: 50 Cent]
Have a baby by me, baby, be a millionaire
Have a baby by me, baby, be a millionaire
Have a baby by me, baby, be a millionaire
Be a millionaire, be a-be a millionaire
Have a baby by me, baby, be a millionaire
Have a baby by me, baby, be a millionaire
Have a baby by me, baby, be a millionaire
Be a millionaire, be a-be a millionaire

[Bridge: Ne-Yo]
I don't play no games (I don't play no games)
So when I’m in that thang (when I'm in that thang)
Come see what I mean (see what I mean)
See what I mean, oh (see what I mean)
I said little mama put me on (baby, put me on)
Bet I'll have you gone (bet I'll have you gone)
Come see what I mean (see what I mean), see what I mean
See what I mean, come see what I mean, come on

[Verse 1: 50 Cent]
First is her neck, yeah, then her back
Me I'm a freak, I get into all that
Girl, I'll perform for ya like a porno star
'Til you've had enough then I just need a little bit more
New music, new mood, new position
New erotic sounds, it's going down, now listen
I can hear your heartbeat, you're sweatin'
I could paint a perfect picture
I get deeper and deeper, I told ya I'd get ya
I’d work that, murk that, just the way you like it, baby
Turn a quickie into an all-nighter maybe
Your sex drive it match my sex drive
Then we be moving as fast as a Nascar rides
Switch gears, slow down, go down, whoa now
You could feel every inch of it when we intimate
I use my tongue, baby, a little sprung maybe
I had your head spinning saying ''50 so crazy''
See 50 Cent LiveGet tickets as low as $53You might also like[Bridge: Ne-yo]
I don't play no games (I don't play no games)
So when I’m in that thang (when I'm in that thang)
Come see what I mean (see what I mean)
See what I mean, oh (see what I mean)
I said little mama put me on (baby, put me on)
Bet I'll have you gone (bet I'll have you gone)
Come see what I mean (see what I mean), see what I mean
(See what I mean) Come see what I mean, come see what I mean

[Chorus: 50 Cent & (Ne-Yo)]
Have a baby by me, baby, be a millionaire (oh)
Have a baby by me, baby, be a millionaire (come see what i mean)
Have a baby by me, baby, be a millionaire (Oh)
Be a millionaire, be a-be a millionaire (Lil mama come see what I mean)
Have a baby by me, baby, be a millionaire (Oh)
Have a baby by me, baby, be a millionaire (Come see what I mean)
Have a baby by me, baby, be a millionaire (Oh)
Be a millionaire, be a-be a millionaire (Yeah, yeah, oh)

[Verse 2: 50 Cent]
Girl, I want you to give me what you got then give me more
Baby, you could start on top or all-fours
You know I like it when you get in to it
Don't nobody do it, uh, like I do it
Feel a rush from my touch
Get intoxicated, drunk off my love, call it Hennessy thug
Passion, you laughin', I make you smile on the regular
Tell me what you want, shawty, and that's what I'mma get to ya
Yo, I need you to be what I need more than liquor and weed
I need you to maybe give me a seed
I need you to give me a reason to breathe
I need you, I'm telling you so now you know what I need
I'll be your part time or full time lover, significant other
Don’t matter which way it go, I'm oh so gutter
Girl, you could get it however you wanna get it
I’m feeling you, still I'm feeling you right now, I'mma get it
[Bridge: Ne-Yo]
I don't play no games (I don't play no games)
So when I’m in that thang (when I'm in that thang)
Come see what I mean (see what I mean)
See what I mean, oh (see what I mean)
I said little mama put me on (baby, put me on)
Bet I'll have you gone (bet I'll have you gone)
Come see what I mean (see what I mean), see what I mean
(See what I mean) Come see what I mean, come see what I mean

[Chorus: 50 Cent]
Have a baby by me, baby, be a millionaire
Have a baby by me, baby, be a millionaire
Have a baby by me, baby, be a millionaire
Be a millionaire, be a-be a millionaire
(Shawty said take it off, I'll take it off)
Have a baby by me, baby, be a millionaire
Have a baby by me, baby, be a millionaire
(Want me to break you off, I'll break you off)
Have a baby by me, baby, be a millionaire
Be a millionaire, be a-be a millionaire
Have a baby by me, baby, be a millionaire
Have a baby by me, baby, be a millionaire
Have a baby by me, baby, be a millionaire
Be a millionaire, be a-be a millionaire10Embed"
Uprising,Muse,"{'2010-01-09': 51, '2010-01-02': 56}","73 ContributorsUprising Lyrics[Verse 1]
Paranoia is in bloom, the PR transmissions will resume
They'll try to push drugs that keep us all dumbed down
And hope that we will never see the truth around
(So come on)

[Verse 2]
Another promise, another seed
Another packaged lie to keep us trapped in greed
And all the green belts wrapped around our minds
And endless red tape to keep the truth confined
(So come on)

[Chorus]
They will not force us
They will stop degrading us
They will not control us
And we will be victorious
(So come on)

[Verse 3]
Interchanging mind control
Come let the revolution take its toll
If you could flick a switch and open your third eye
You'd see that we should never be afraid to die
(So come on)
You might also like[Verse 4]
Rise up and take the power back
It's time the fat cats had a heart attack
You know that their time's coming to an end
We have to unify and watch our flag ascend
(So come on)

[Chorus]
They will not force us
They will stop degrading us
They will not control us
And we will be victorious
(So come on)

[Bridge]
Hey, hey
Hey, hey
Hey, hey
Hey, hey

[Chorus]
They will not force us
They will stop degrading us
They will not control us
And we will be victorious
(So come on)
[Outro]
Hey, hey
Hey, hey59Embed"
Crawl,Chris Brown,"{'2010-01-09': 53, '2010-01-02': 68}","16 ContributorsCrawl Lyrics[Verse 1]
Everybody sees this you
I'm the one that lost the view
Everybody says we're through
I hope you haven't said it too

[Pre-Chorus]
So where do we go from here
With all this fear in our eyes?
And where can love take us now?
We've been so far down

[Chorus]
We can still touch the sky if we crawl
'Til we can walk again
Then we'll run until we're strong enough to jump
Then we'll fly until there is no wind
So let's crawl, crawl, crawl
Back to love, yeah
Back to love, yeah

[Verse 2]
Why did I change the pace?
Hearts were never meant to race
Always felt the need for space
And now I can't reach your face (Your face)
You might also like[Pre-Chorus]
So where are you standing now?
Are you in the crowd of my faults? (My faults, oh)
Love, can't you see my hand?
I need one more chance

[Chorus]
We can still have it all so we'll crawl (If we crawl)
'Til we can walk again
Then we'll run (Then we'll run) until we're strong enough to jump
Then we'll fly until there is no wind
So let's crawl, crawl, crawl
Back to love, yeah
Back to love, yeah

[Bridge]
Everybody sees this you
Well, I never wanna lose that view

[Chorus]
So we'll crawl (If we crawl) 'til we can walk again
Then we'll run (Then we'll run) until we're strong enough to jump
Then we'll fly until there is no wind
So let's crawl, crawl, crawl
So we'll crawl (If we crawl, oh) 'til we can walk again ('Til we can walk again)
Then we'll run (Then we'll run) until we're strong enough to jump
Then we'll fly (Yeah, yeah) until there is no wind
So let's crawl, let's crawl, let's crawl
Back to love13Embed"
I Will Not Bow,Breaking Benjamin,"{'2010-01-09': 64, '2010-01-02': 81}","41 ContributorsI Will Not Bow Lyrics[Intro]
Fall

[Verse 1]
Now the dark begins to rise
Save your breath
It's far from over
Leave the lost and dead behind
Now's your chance to run for cover
I don't want to change the world
I just want to leave it colder
Light the fuse and burn it up
Take the path that leads to nowhere

[Pre-Chorus]
All is lost again
But I'm not giving in

[Chorus]
I will not bow
I will not break
I will shut the world away
I will not fall
I will not fade
I will take your breath away
You might also like[Post-Chorus]
Fall

[Verse 2]
Watch the end through dying eyes
Now the dark is taking over
Show me where forever dies
Take the fall
And run to heaven

[Pre-Chorus]
All is lost again
But I'm not giving in

[Chorus]
I will not bow
I will not break
I will shut the world away
I will not fall
I will not fade
I will take your breath away
And I'll survive
Paranoid
I have lost the will to change
And I am not proud
Coldblooded fake
I will shut the world away
[Bridge]
Open your eyes

[Chorus]
I will not bow
I will not break
I will shut the world away
I will not fall
I will not fade
I will take your breath away
And I'll survive
Paranoid
I have lost the will to change
And I am not proud
Coldblooded fake
I will shut the world away

[Outro]
Fall16Embed"
Do I,Luke Bryan,"{'2010-01-09': 50, '2010-01-02': 43}","16 ContributorsDo I Lyrics[Verse 1]
Baby, what are we becomin'?
It feels just like we're always runnin'
Rollin' through the motions every day

[Verse 2]
I could lean in to hold you
Or act like I don't even know you
Seems like you could care less either way

[Pre-Chorus]
What happened to that girl I used to know?
I just want us back to the way we were before

[Chorus]
Do I turn you on at all when I kiss you, baby?
Does the sight of me wantin' you drive you crazy?
Do I have your love? Am I still enough?
Tell me, don't I? Or tell me, do I, baby?
Give you everything that you ever wanted?
Would you rather just turn away and leave me lonely?
Do I just need to give up and get on with my life?
Baby, do I?

[Verse 3]
Remember when we didn't have nothin'
But a perfect simple kind of lovin'?
Baby, those sure were the days
See Luke Bryan LiveGet tickets as low as $22You might also like[Pre-Chorus]
There was a time our love ran wild and free
But now I'm second guessin' everything I see

[Chorus]
Do I turn you on at all when I kiss you, baby?
Does the sight of me wantin' you drive you crazy?
Do I have your love? Am I still enough?
Tell me, don't I? Or tell me, do I, baby
Give you everything that you ever wanted?
Would you rather just turn away and leave me lonely?
Do I just need to give up and get on with my life?
Baby, do I

[Bridge]
Still give you what you need?
Still take your breath away?
Light up the spark way down deep?
Baby, do I?!

[Chorus]
Whoa! Do I turn you on at all when I kiss you, baby?
Does the sight of me wantin' you drive you crazy?
Do I have your love? Am I still enough?
Tell me, don't I? Or tell me, do I, baby
Give you everything that you ever wanted?
Would you rather just turn away and leave me lonely?
Do I just need to give up and get on with my life?
Tell me, baby, do I get one more try?
Do I?
Baby, do I?10Embed"
Hot Mess,Cobra Starship,{'2010-01-09': 88},"5 ContributorsHot Mess Lyrics[Verse 1]
You were a problem child
Been grounded your whole life
So now you running wild
Playing with them good girls
Naw, that ain't your style
You think you're hot shit
And ooh, I love it, I love it, yeah, yeah

[Pre-Chorus]
Stumbling but yeah, you're still looking hella fine
Keep doing what you're doing, I'ma make you mine

[Chorus 2]
Well, you're a hot mess and I'm falling for you
And I'm like hot damn! Let me make you my boo
'Cause you can shake it, shake it, shake it
Yeah, you know what to do
You're a hot mess
I'm loving it, hell yes!

[Verse 2]
I've been hypnotized
The city's your playground
I watch you take a bite
At 5am roaming in the streets
Drunk all night
You think you're hot shit
And ooh, I love it, I love it, yeah, yeah
You might also like[Pre-Chorus]
Stumbling but yeah, you're still looking hella fine
Keep doing what you're doing, I'ma make you mine

[Chorus 2]
Well, you're a hot mess and I'm falling for you
And I'm like hot damn! Let me make you my boo
'Cause you can shake it, shake it, shake it
Yeah, you know what to do
You're a hot mess
I'm loving it, hell yes!
You're a hot mess and I'm falling for you
And I'm like hot damn! Let me make you my boo
'Cause you can shake it, shake it, shake it
Yeah, you know what to do
You're a hot mess
I'm loving it, hell yes!

[Verse 3]
If you're dancing up on tables
You go, you go, you got it, girl
Say that you're unstable
You go coco, you got it, girl
Dancing up on tables
Say that you're unstable
You're a haha-haha-ha yeah, you're a hot mess
Haha-haha-ha, we're singing hell yes
[Chorus]
Well, you're a hot mess and I'm falling for you
And I'm like hot damn! Let me make you my boo
'Cause you can shake it, shake it, shake it
Yeah, you know what to do
You're a hot mess
I'm loving it, hell yes!
You're a hot mess and I'm falling for you
And I'm like hot damn! Let me make you my boo
'Cause you can shake it, shake it, shake it
Yeah, you know what to do
You're a hot mess
I'm loving it, hell yes (hell yes)
Hot mess
I'm loving it, hell yes (hell yes)
Hot mess
I'm loving it, hell yesEmbed"
Body Language,Jesse McCartney Featuring T-Pain,"{'2010-01-09': 45, '2010-01-02': 80}","5 ContributorsBody Language (Remix) Lyrics[Intro: T-Pain & Jesse McCartney]
Nappy Boy, Pretty Boy collaboration
That thing you got behind you is amazing
Ooh that body’s like music to my ear
Ooh that body’s like music to my ear
Ooh that body’s like music to my ear
Cause what you want is right here

[Verse 1: Jesse McCartney]
Ooh she, oh she so international
The way, the way she get it on the floor
I’m tryin, I’m tryin’ to holler at you
I want to get to know you better

[Pre-Chorus: Jesse McCartney & (T-Pain)]
Parlez-vous français?
Konichiwa, come and move in my way
(Hey, little chica from Guadeloupe)
That thing you got behind you is amazing

[Chorus: Jesse McCartney]
I don’t speak Spanish, Japanese or French
But the way that body’s talkin’ definitely makes sense
It’s her, her body, her body, her body language
It’s her, her body, her body, her body language
The way she moves around
When she grinds to the beat
Breaking it down articulately
It’s her, her body, her body, her body language
It’s her, her body, her body
You might also like[Post-Chorus: Jesse McCartney]
That make me wanna say
He-eey, he-eey, he-eey
It’s her, her body, her body
Her body language, come on

[Verse 2: Jesse McCartney]
Shorty, let me whisper in your ear
Tell you, everything you wanna hear
You got my vote Hottest Girl of the Year
Let’s have a ce-lebra-tion, baby

[Pre-Chorus: Jesse McCartney & (T-Pain)]
Parlez-vous français?
Konichiwa, come and move in my way
(Hey, little chica from Guadeloupe)
That thing you got behind you is amazing

[Chorus: Jesse MCartney]
I don’t speak Spanish, Japanese or French
But the way that body’s talkin’ definitely makes sense
It’s her, her body, her body, her body language
It’s her, her body, her body, her body language
The way she moves around
When she grinds to the beat
Breaking it down articulately
It’s her, her body, her body, her body language
It’s her, her body, her body
[Post-Chorus: Jesse McCartney]
That make me wanna say
He-eey, he-eey, he-eey
It’s her, her body, her body
Her body language, come on

[Verse 3: T-Pain]
Nappy Boy, Pretty Boy collaboration
That thing you got behind you is amazing
I’m lifting up my voice to say
You’re the hottest girl in the world today
The way you shake
You got me losing my mind
You’re banging like a speakerbox
Turn around; the party stops
Universal lady, let me take you away

[Chorus: Jesse MCartney]
I don’t speak Spanish, Japanese or French
But the way that body’s talkin’ definitely makes sense
It’s her, her body, her body, her body language
It’s her, her body, her body, her body language
The way she moves around
When she grinds to the beat
Breaking it down articulately
It’s her, her body, her body, her body language
It’s her, her body, her body
[Post-Chorus: Jesse McCartney]
That make me wanna say
He-eey (That make me wanna say)
He-eey (That make me wanna say)
He-eey
It’s her, her body, her body
Her body language, come on

[Outro: Jesse McCartney]
Oh that body’s like music to my ear
Oh that body’s like music to my ear
Oh that body’s like music to my ear
'Cause what you want is right here1Embed"
Red Light,David Nail,"{'2010-01-09': 83, '2010-01-02': 63}","4 ContributorsRed Light Lyrics[Verse 1]
So this is how it ends
This is where it all goes down
This is what ""I don't love you"" feels like
It ain't the middle of the night
And it ain't even raining outside
It ain't exactly what I had in mind, for goodbye

[Chorus]
At a red light in the sunshine on a Sunday
Nothing to say, don't even try
Some are coming home, some are leaving town
While my world's crashing down
On a Sunday in the sunshine
At a red light

[Verse 2]
I thought she was gonna say
Something 'bout that couple kids and crossing the street
Or something about this beautiful day
But she just looked me in the eye
Said ""it's over"", didn't try to lie or pick a fight
I might have seen it coming that way

[Chorus]
But at a red light in the sunshine on a Sunday
Nothing to say, don't even try
Some are coming home, some are leaving town
While my world's crashing down
On a Sunday in the sunshine
At a red light
You might also like[Bridge]
There's a mama calming down a little baby
In the backseat in front of me
There's an old man dressed in his Sunday best
Just waiting on green
But I can't see getting past

[Chorus]
This red light in the sunshine on a Sunday
Nothing to say, don't even try
Some are coming home, some are leaving town
While my world's crashing down
On a Sunday in the sunshine

[Chorus]
At a red light in the sunshine on a Sunday
Nothing to say, don't even try
Some are coming home, some are leaving town
While my world's crashing down
On a Sunday in the sunshine

[Outro]
At a red light
At a red light
At a red light
At a red lightEmbed"
