song,artist,dateRank,lyrics
Vanilla Twilight,Owl City,{'2010-01-09': 72},"54 ContributorsTranslationsPortuguêsVanilla Twilight Lyrics[Verse 1]
The stars lean down to kiss you
And I lie awake and miss you
Pour me a heavy dose of atmosphere
'Cause I'll doze off safe and soundly
But I'll miss your arms around me
I'd send a postcard to you, dear
'Cause I wish you were here

[Verse 2]
I'll watch the night turn light blue
But it's not the same without you
Because it takes two to whisper quietly
The silence isn't so bad
'Til I look at my hands and feel sad
'Cause the spaces between my fingers
Are right where yours fit perfectly
I'll find repose in new ways
Though I haven't slept in two days
'Cause cold nostalgia chills me to the bone
But drenched in vanilla twilight
I'll sit on the front porch all night
Waist-deep in thought because when I think of you
I don't feel so alone

[Bridge]
I don't feel so alone
I don't feel so alone
As many times as I blink, I'll think of you
Tonight (Tonight, tonight, tonight)
I'll think of you tonight
You might also like[Verse 3]
When violet eyes get brighter
And heavy wings grow lighter
I'll taste the sky and feel alive again
And I'll forget the world that I knew
But I swear I won't forget you
Oh, if my voice could reach back through the past
I'd whisper in your ear
""Oh darling, I wish you were here""

[Instrumental Outro]29Embed"
History In The Making,Darius Rucker,"{'2010-01-09': 81, '2010-01-02': 66}","5 ContributorsHistory In the Making Lyrics[Verse 1]
Do not move, baby Do not move
Ah, look at you; I just want to take this in
The moonlight dancing off your skin

Our time let us take our time
I just want to look in your eyes and catch my breath
Because I got a feeling

[Chorus]
This could be a one of those memories
We want to hold on to, cling to, the one we cannot forget
Baby this could be our last first kiss, the door to forever
What if this was that moment, that chance we are taking?
History in the making

[Verse 2]
Inside, baby inside
Can you feel the butterflies floating all around?
Because I can sure feel it now

Tonight, maybe tonight
Is the start of a beautiful ride that will never end
And baby I got a feeling

[Chorus]
This could be a one of those memories
We want to hold on to, cling to, the one we cannot forget
Baby this could be our last first kiss, the door to forever
What if this was that moment, that chance we are taking?
History in the making
See Darius Rucker LiveGet tickets as low as $70You might also like[Interlude]
Right here, right now
Holding you in my arms

[Chorus]
This could be a one of those memories
We want to hold on to, cling to, the one we cannot forget
Baby this could be our last first kiss, the door to forever
What if this was that moment, that chance we are taking?
History in the makingEmbed"
Two Is Better Than One,Boys Like Girls Featuring Taylor Swift,"{'2010-01-09': 20, '2010-01-02': 23}","22 ContributorsTwo Is Better Than One Lyrics[Verse 1: Martin Johnson]
I remember what you wore on the first day
You came into my life and I thought
""Hey, you know, this could be something""
'Cause everything you do and words you say
You know that it all takes my breath away
And now I'm left with nothing

[Chorus: Martin Johnson & Taylor Swift]
So maybe it's true that I can't live without you
And maybe two is better than one
But there's so much time to figure out the rest of my life
And you've already got me coming undone
And I'm thinking two is better than one

[Verse 2: Martin Johnson & Taylor Swift]
I remember every look upon your face
The way you roll your eyes, the way you taste
You make it hard for breathing
'Cause when I close my eyes and drift away
I think of you and everything's okay
I'm finally now believing

[Chorus: Martin Johnson & Taylor Swift]
Then maybe it's true that I can't live without you
And maybe two is better than one
But there's so much time to figure out the rest of my life
And you've already got me coming undone
And I'm thinking two is better than one
See BOYS LIKE GIRLS LiveGet tickets as low as $23You might also like[Bridge: Martin Johnson]
I remember what you wore on the first day
You came into my life and I thought, hey (Hey, hey)

[Chorus: Martin Johnson & Taylor Swift]
Maybe it's true that I can't live without you
And maybe two is better than one
But there's so much time to figure out the rest of my life
And you've already got me coming undone

[Outro: Martin Johnson & Taylor Swift]
And I'm thinking, ooh, I can't live without you
'Cause, baby, two is better than one
There's so much time to figure out the rest of my life
But I'll figure out with all that's said and done
Two is better than one
Two is better than one12Embed"
If You Only Knew,Shinedown,"{'2010-01-09': 47, '2010-01-02': 46}","14 ContributorsIf You Only Knew Lyrics[Verse 1]
If you only knew
I'm hangin' by a thread, the web I spin for you
If you only knew
I'd sacrifice my beating heart before I'd lose you

[Pre-Chorus]
I still hold on to the letters
You returned, I swear I've lived and learned

[Chorus]
It's 4:03 and I can't sleep
Without you next to me I toss and turn like the sea
If I drown tonight, bring me back to life
Breathe your breath in me
The only thing that I still believe in is you
If you only knew

[Verse 2]
If you only knew
How many times I counted all the words that went wrong
If you only knew
How I refuse to let you go even when you're gone

[Pre-Chorus]
I don't regret any days I spent
Nights we shared, or letters that I sent
See Shinedown LiveGet tickets as low as $91You might also like[Chorus]
It's 4:03 and I can't sleep
Without you next to me I toss and turn like the sea
If I drown tonight, bring me back to life
Breathe your breath in me
The only thing that I still believe in is you
If you only knew
If you only knew

[Bridge]
I still hold on to the letters
You returned, you helped me live and learn

[Chorus]
It's 4:03 and I can't sleep
Without you next to me I toss and turn like the sea
If I drown tonight, bring me back to life
Breathe your breath in me
The only thing that I still
Believe in is you (If I drown tonight, bring me back to life)
Believe in is you (If I drown tonight, bring me back to life)
I still believe in you
If you only knew3Embed"
Shut It Down,Pitbull Featuring Akon,"{'2010-01-09': 87, '2010-01-02': 69}","21 ContributorsShut It Down Lyrics[Intro: Pitbull & Akon]
Mr. 305
I want everybody (Akon)
To get ready (Clinton Sparks)
'Cause we about to shut down (Snake)

[Chorus: Akon & Pitbull]
Ohh-ohh
Can't tell me nothing now
Baby, I know how to fly
Ohh-ohh
Can't nothing hold me down, I'm gonna touch the sky
(Oh-oh-oh-oh-oh)
Can't nothing, no, hold me down
(Oh-oh-oh-oh-oh)
(Oh-oh-oh-oh-oh)
(Can't nothing no, hold me down)
(Oh-oh-oh-oh-oh)
(Can't nothing no, hold me down)
(Oh-oh-oh-oh-oh)
(Now watch me, now watch me, watch me shut this thang down)

[Refrain: Pitbull]
Sube sube, hasta la nube
Pa delante-lante
No mires pa tras
See Pitbull LiveGet tickets as low as $173You might also like[Verse 1: Pitbull]
I hit the jackpot cha-cha-cha-cha-cha-cha-ching
Real chicos do real things on the road to get diamond rings
Moved up from the streets, graduated hustla
On his way to an entrepreneur, undefeated, double shooter

[Pre-Chorus: Pitbull]
Now baby, save me, from the game before it plays me
My life's a movie, call me Martin Scorsese
(Oh-oh-oh-oh-oh)
I couldn't care less if you love me or hate me
(Oh-oh-oh-oh-oh)
(Oh-oh-oh-oh-oh)
(Oh-oh-oh-oh-oh)
Life's a bitch, now fuck you, pay me (Woo)

[Refrain: Pitbull]
Sube sube, hasta la nube
Pa delante-lante
No mires pa tras
Dale

[Chorus: Akon]
Ohh-ohh
Can't tell me nothing now
Baby, I know how to fly
Ohh-ohh
Can't nothing hold me down
I'm gonna touch the sky skyy
(Oh-oh-oh-oh-oh)
(Oh-oh-oh-oh-oh)
(Oh-oh-oh-oh-oh)
[Verse 2: Pitbull & Akon]
Woo
Lose my money, honey
Now pay me what you owe me
My mens a hurricane, you should see the way she glow it
I don't make it rain
I speak that global warming
This same no biggie ain't ready to dance

[Pre-Chorus: Pitbull]
Now baby, save me, from the game before it plays me
My life's a movie, call me Martin Scorsese
(Oh-oh-oh-oh-oh)
I couldn't care less if you love me or hate me
(Oh-oh-oh-oh-oh)
(Oh-oh-oh-oh-oh)
(Oh-oh-oh-oh-oh)
Life's a bitch, now fuck you, pay me (Woo!)

[Refrain: Pitbull]
Sube sube, hasta la nube
Pa delante-lante
No mires pa tras
Dale

[Chorus: Akon]
Ohh-ohh
Can't nothing hold me down
I'm gonna touch the sky, sky
Ohh-ohh
Can't tell me nothing now
Baby, I know how to fly, fly
Ohh-ohh
Can't nothing hold me down
I'm gonna touch the sky, sky
(Oh-oh-oh-oh-oh)
(Oh-oh-oh-oh-oh)
(Oh-oh-oh-oh-oh)
[Chorus: Akon & Pitbull]
(Oh-oh-oh-oh-oh)
Can't nothing, nothing
Hold me down
(Oh-oh-oh-oh-oh)
(Oh-oh-oh-oh-oh)
Can't nothing nothing
Hold me down
(Oh-oh-oh-oh-oh)
(Oh-oh-oh-oh-oh)
Can't nothing nothing
Hold me down
(Oh-oh-oh-oh-oh)
(Oh-oh-oh-oh-oh)
Now watch me, now watch me
(Oh-oh-oh-oh-oh)
Now watch me shut this thang down
(Oh-oh-oh-oh-oh)

[Outro: Pitbull]
It's my life, I'm a do what I do
And if you don't like, it's cool, fuck youEmbed"
I Invented Sex,Trey Songz Featuring Drake,"{'2010-01-09': 62, '2010-01-02': 42}","27 ContributorsI Invented Sex Lyrics[Intro: Trey Songz]
Hey girl, hey girl, hey girl
This goes out to the beautiful girls
Hey girl, hey girl, hey girl
Which one of y'all, which, which one
Which, which one of y'all
Which one of y'all going home with Trigga?

[Verse 1: Trey Songz]
I see you in the club, ooh, shawty
Walking past a nigga looking at me all naughty
Then I said, ""Baby, wassup?""
Reach for that hand shake, got a hug
Bottles of the Ace got me with a lil buzz
Up in VIP with all my thug niggas
You leaned over and said you want me
Girl, when the valet pull the Benz up
Off to the crib, shawty, where we gon' end up
Girl, sit back, relax, hold up
Let me turn the radio on

[Chorus: Trey Songz]
Girl, when I get you to the crib
Upstairs to the bed
Girl, you gon' think, girl, you gon' think
Girl, you gon' think, girl, you gon' think
Girl, when I pull back them sheets
And you climb on top of me
Girl, you gon' think, girl, you gon' think
Girl, you gon' think, girl, you gon' think
You gon' think I invented sex
You gon' think I invented sex
You gon' think I invented sex
See Trey Songz LiveGet tickets as low as $58You might also like[Verse 2: Trey Songz]
Put the code in the gate, pull up to the driveway
Said she like the way I touch her, listening to Usher
I got a confession
Now we 'bout to sin, but your body is a blessing
Father, forgive me
Girl, can we take it up stairs? My bed's waiting there
All I wanna do is is give you all of me
Won't you give me all of you?
I want your body like right now
You know I live a Magnum lifestyle
Baby, turn the lights down and I'mma turn you on

[Chorus: Trey Songz]
Girl, when I get you to the crib
Upstairs to the bed
Girl, you gon' think, girl, you gon' think
Girl, you gon' think, girl, you gon' think
Girl, when I pull back them sheets
And you climb on top of me
Girl, you gon' think, girl, you gon' think
Girl, you gon' think, girl, you gon' think
You gon' think I invented sex
You gon' think I invented sex
'Cause I do it like I think
You gon' think I invented sex
[Verse 3: Drake]
All right
It's a celebration clap, clap, bravo
Lobster and shrimp and a glass of Moscato
For the girl who's a student and the friend who's a model
Finish the whole bottle and we gonna do it big like this
Yeah, and he was just practice
He ain't in your world, you can take him off your atlas
Girl,  you on fire, can I be the one you match with?
I'll give you the credit card and baby you can max this out
Show me where your tats is
Show me where you heads at, maybe I can grasp it
If you ever come up with a question, you should ask it
Caught up on your ex still? I can get you past it
Yeah, and your friends all suggest
What's the chance of this nigga being better than the rest?
Just tell 'em you appreciate the help
But you just got to know for yourself

[Chorus: Trey Songz]
Girl, when I get you to the crib
Upstairs to the bed
Girl, you gon' think, girl, you gon' think
Girl, you gon' think, girl, you gon' think
Girl, when I pull back them sheets
And you climb on top of me
Girl, you gon' think, girl, you gon' think
Girl, you gon' think, girl, you gon' think
You gon' think I invented sex
You gon' think I invented sex
You gon' think I invented sex
[Outro: Trey Songz]
Now who's coming home with me?
Tell me who's coming with me
I wanna know who's coming home with?
Tell me who's coming with me
Is it you? Is it you? Is it you? Is it you?
Is it you? Is it you? Is it you? Is it you?15Embed"
Rain,Creed,{'2010-01-09': 91},"9 ContributorsRain Lyrics[Verse 1]
Can you help me out, can you lend me a hand?
It's safe to say that I'm stuck again
Trapped between this life and the light
I just can't figure out, how to make it right

[Pre-Chorus]
A thousand times before
I've wondered if there's something more, something more

[Chorus]
I feel it's going to rain like this for days
So let it rain down and wash everything away
I hope that tomorrow the sun will shine
With every tomorrow comes another life
I feel it's going to rain, for days and days
(I feel it's going to rain)

[Verse 2]
I tried to figure out, I can't understand
What it means to be whole again
Trapped between the truth and the consequence
Nothing's real, nothing's making sense

[Pre-Chorus]
A thousand times before
I've wondered if there's something more, something more
You might also like[Chorus]
I feel it's going to rain like this for days
So let it rain down and wash everything away
I hope that tomorrow the sun will shine
I feel it's going to rain like this, rain like this, rain like this

[Bridge]
Fall down, wash away my yesterdays
Fall down, so let the rain fall down on me

[Chorus]
I feel it's going to rain like this for days
So let it rain down and wash everything away
I hope that tomorrow the sun will shine
I feel it's going to rain like this, rain like this

[Outro]
So let the rain fall
I feel it's going to rain like this rain like this
So let the rain fall down
I feel it's going to rain like this
I feel it's going to rain2Embed"
Already Gone,Kelly Clarkson,"{'2010-01-09': 28, '2010-01-02': 18}","30 ContributorsAlready Gone Lyrics[Verse 1]
Remember all the things we wanted
Now all our memories, they're haunted
We were always meant to say goodbye
Even with our fists held high
It never would've worked out right, yeah
We were never meant for do or die

[Pre-Chorus]
I didn't want us to burn out
I didn't come here to hurt you, now I can't stop

[Chorus]
I want you to know that it doesn't matter
Where we take this road
Someone's gotta go
And I want you to know you couldn't have loved me better
But I want you to move on
So I'm already gone

[Verse 2]
Looking at you makes it harder
But I know that you'll find another
That doesn't always make you wanna cry
It started with a perfect kiss then
We could feel the poison set in
""Perfect"" couldn't keep this love alive
[Pre-Chorus 2]
You know that I love you so, I
Love you enough to let you go

[Chorus]
I want you to know that it doesn't matter
Where we take this road
Someone's gotta go
And I want you to know you couldn't have loved me better
But I want you to move on
So I'm already gone

[Post-Chorus]
I'm already gone, already gone
You can't make it feel right when you know that it's wrong
I'm already gone, already gone
There's no moving on, so I'm already gone

[Bridge]
Ahh, already gone, already gone, already gone (Ooh, oh)
Ahh, already gone, already gone, already gone, yeah

[Verse 3]
Remember all the things we wanted
Now all our memories, they're haunted
We were always meant to say goodbye
You might also like[Chorus]
I want you to know that it doesn't matter
Where we take this road
Someone's gotta go
And I want you to know you couldn't have loved me better
But I want you to move on
So I'm already gone

[Outro]
I'm already gone, already gone
You can't make it feel right when you know that it's wrong
I'm already gone, already gone
There's no moving on
So I'm already gone21Embed"
Meet Me Halfway,The Black Eyed Peas,"{'2010-01-09': 11, '2010-01-02': 9}","2 ContributorsThe Ultra-Playlist Pt.1/10 Lyrics1.Taylor Swift - Fifteen
2.Little Mix - Little Me
3.Catatonia - Mulder & Scully
4.Mariah Carey - Hero
5.B.o.b ft.Hayley Williams - Airplanes
6.Katy Perry - The One That Got Away
7.Shawn Mendes - Stitches
8.Ariana Grande - Ghostin
9.Shania Twain - That Don't Impress Me Much
10.Meghan Trainor ft.John Legend - Like I'm Gonna Lose You

11.Camila Cabello - I Have Questions
12.Gotye - Somebody That I Used To Know
13.Ruelle - Monsters
14.Katherine McNamara - Ember
15.Maren Morris - I Wish I Was
16.Ellie Goulding - This Love (Will Be Your Downfall)
17.Sugababes - About You Now
18.Britney Spears - ...Baby One Morе Time
19.Spice Girls - Viva Forevеr
20.Panic At The Disco - High Hopes

21.Ava Max - So Am I
22.Charlie Puth - Attention
23.One Direction - What Makes You Beautiful
24.Alexis Jordan - Happiness
25.Fifth Harmony ft.Gucci Mane - Down
26.Sia - Titanium
27.No Doubt - Don't Speak
28.Selena Gomez & The Scene - Falling Down
29.Carly Rae Jepsen - LA Hallucinations
30.All Saints - Never Ever
You might also like31.Olly Murs - Dear Darlin'
32.Girls Aloud - The Loving Kind
33.Meredith Brooks - Bitch
34.Jennifer Paige - Crush
35.Ashlee Simpson - Pieces Of Me
36.Miley Cyrus - Wreckingball
37.Kacey Musgraves - High Horse
38.John Newman - Love Me Again
39.Paloma Faith - Only Love Can Hurt Like This
40.Cheryl - Fight For This Love

41.Shakira - Animal City
42.Beyoncé - Irreplaceable
43.5 Seconds Of Summer - Youngblood
44.JLS - One Shot
45.Jonas Brothers - Sucker
46.Alanis Morissette - Ironic
47.Kelly Clarkson - Heartbeat Song
48.Ed Sheeran - Beautiful People
49.Jennifer Lopez - Jenny From The Block
50.Jess Glynne - I'll Be There

51.Atomic Kitten - Whole Again
52.Gwen Stefani - You're My Favourite
53.The Saturdays - My Heart Takes Over
54.Rachel Platten - Angels In Chelsea
55.Avril Lavigne - Complicated
56.Girls Can't Catch - Echo
57.Sofia Carson - Ins And Outs
58.Grace VanderWaal - So Much More Than This
59.Ella Henderson - Mirror Man
60.Emeli Sande - Hurts
61.Nelly Furtado - Maneater
62.Pink - Walk Me Home
63.Dua Lipa - New Rules
64.The Vamps ft.Demi Lovato - Somebody To You
65.Beauty & The Beast - Something There
66.Lorde - Royals
67.Kesha - Praying
68.Leona Lewis - Bleeding Love
69.Rachel Stevens - Sweet Dreams My LA Ex
70.Rixton - Me & My Broken Heart

71.Frozen - Let It Go
72.The Girl & The Dreamcatcher - Glowing In The Dark
73.Pixie Lott - Turn It Up
74.Anne-Marie - Ciao Adios
75.Adele - Send My Love
76.Idina Menzel - Cake
77.Rita Ora - I Will Never Let You Down
78.Una Healy - Battlelines
79.Destiny's Child - Survivor
80.Harry Styles - Adore You

81.Mabel - Don't Call Me Up
82.Tim McGraw ft.Taylor Swift - Highway Don't Care
83.Olivia Rodrigo - Good 4 U
84.Bebe Rexha - Sabotage
85.Arlo Parks - Caroline
86.au/ra - I miss u
87.Union J - Carry You
88.ROSE - Gone
89.Sadie Jean - WYD Now?
90.Abe Parker - Butterflies
91.Charli XCX - Boomclap
92.Selena Gomez - Wolves
93.The Chainsmokers ft.Halsey - Closer
94.Jamelia - Superstar
95.Holly Valance - Kiss Kiss
96.Black Eyed Peas - Meet Me Halfway
97.Descendants - Rotten To The Core
98.Jade Bird - Cathedral
99.Carrie Underwood - Jesus Take The Wheel
100.Miranda Lambert - The House That Built MeEmbed"
Cryin' For Me (Wayman's Song),Toby Keith,{'2010-01-02': 88},"4 ContributorsCryin’ For Me (Wayman’s Song) Lyrics[Verse 1]
Got the news on Friday morning
But a tear I couldn't find
You showed me how I am supposed to live
Now you showed me how to die
I was lost til Sunday morning
I woke up to face my fear
While writing you this good bye song I found a tear

[Chorus]
I'm going to miss that smile
I'm going to miss you my friend
Even though it hurts the way it ended up
I'd do it all again
So play it sweet in heaven
'Cause that's right where you want to be
I'm not crying' cause I feel so sorry for you
I am crying' for me

[Verse 2]
I got up and dialed your number
Your voice came on the line
That old familiar message
I have heard a thousand times
It just said, ""Sorry that I missed you
Leave a message and god bless""
I know that you think I am crazy
But I just had to hear your voice I guess
You might also like[Chorus]
I'm going to miss that smile
I'm going to miss you my friend
Even though it hurts the way it ended up
I'd do it all again
So play it sweet in heaven
'Cause that's right where you want to be
I'm not crying' cause I feel so sorry for you
I am crying' for me

[Bridge]
Oh
So play your upside down, left handed
Backward bass guitar
I'll see you on the other side superstar

[Chorus]
I'm going to miss that smile
I'm going to miss you my friend
Even though it hurts the way it ended up
I'd do it all again
So play it sweet in heaven
'Cause that's right where you want to be
I'm not crying' cause I feel so sorry for you
I am crying' for me
[Outro]
I'm still crying'
I'm crying' for me
Oh
I'm still crying'Embed"
Use Somebody,Kings Of Leon,"{'2010-01-09': 35, '2010-01-02': 25}","74 ContributorsUse Somebody Lyrics[Verse 1]
I've been roamin' around, always lookin' down at all I see
Painted faces fill the places I can't reach
You know that I could use somebody
You know that I could use somebody
Someone like you and all you know and how you speak
Countless lovers under cover of the street
You know that I could use somebody
You know that I could use somebody

[Chorus]
Someone like you

[Verse 2]
Off in the night, while you live it up, I'm off to sleep
Wagin' wars to shape the poet and the beat
I hope it's gonna make you notice
I hope it's gonna make you notice

[Chorus]
Someone like me
Someone like me
Someone like me
Somebody

[Bridge]
Don't let it out
Don't let it out
Don't let it out
Don't let it out
Don't let it out
Don't let it out
Don't let it out
You might also like[Guitar Solo]

[Chorus]
Someone like you
Somebody
Someone like you
Somebody
Someone like you
Somebody

[Outro]
I've been roamin' around, always lookin' down at all I see51Embed"
Gangsta Luv,Snoop Dogg Featuring The-Dream,"{'2010-01-09': 41, '2010-01-02': 35}","17 ContributorsGangsta Luv Lyrics[Intro: Snoop Dogg]
Radio Killa, Big Snoop D-O-dub
The-American-Dream...
Aiyyo nephew, why don't come up off them keys
And sing a 'lil somethin for the ladies
Yanuhtalkinbot? Let 'em know how we feelin right now

[Chorus: The-Dream]
Every time I come around, shawty love me down
Run up on me like click-clack, the gun out like take that
She make it do what it do
When we doing what we doing in the back of the 'Llac
I'm like come up off of that
And every night her body get stacked
I got that gangsta, gang-gangsta
That gangsta, gang-gangsta
That gangsta, gang-gangsta
That gangsta luv

[Verse 1: Snoop Dogg]
Yeah, she love it the way I put it on her
Blowin trees, summer breeze, sippin Coronas
Boss Dogg, I give it to her right, and she like it
She on the hip like a Sidekick
Is he, one of the coolest of fool on the flo'?
I whispered in her ear, ""C'mere, you're ready to go?""
I rolled up a winna and put it up in the air
Got that lil' dress on, you comin up outta there, yeah!
She like that, you like that?
You say you bite, well I bite back
And I'm all go, we can do it 'til tomorrow
I beat it up like Harpo
Snoopy, I go hard baby, yes
Kissin on ya chest and I'm diggin out your stress
I won't stop 'til you're finished
But you ain't felt love 'til a gangsta get up in it
Dream
You might also like[Chorus: The-Dream]
Every time I come around, shawty love me down
Run up on me like click-clack, the gun out like take that
She make it do what it do
When we doing what we doing in the back of the 'Llac
I'm like come up off of that
And every night her body get stacked
I got that gangsta, gang-gangsta
That gangsta, gang-gangsta
That gangsta, gang-gangsta
That gangsta luv

[Verse 2: Snoop Dogg]
She always call in the middle of the night
Cause I'm a Dogg, I'mma give her what she like
She say my name loud, I say her name low
That's what I aim fo', that's how the game go
Baby like the way I wake her up (Why?)
'Cause I'm a gangsta, I grab her by the butt (oh)
Pull her to my side, I'm in deep
Woke that ass up, just to put her to sleep
Everyday, it's the same thang, I creep in
It's like ""True Blood"", I sink my teeth in
I gotta have it, the L.B. raised me
We was taught to dick 'em down crazy
Lights out, I'm so lit
Mommy so gone, daddy won't quit
I won't stop 'til you're finished
You ain't felt love 'til a gangsta get up in it
Dream
[Chorus: The-Dream]
Every time I come around, shawty love me down
Run up on me like click-clack, the gun out like take that
She make it do what it do
When we doing what we doing in the back of the 'Llac
I'm like come up off of that
And every night her body get stacked
I got that gangsta, gang-gangsta
That gangsta, gang-gangsta
That gangsta, gang-gangsta
That gangsta luv

[Verse 4Snoop Dogg]
This the life that you show
The loop, the Coupe, the grove
An'thing goes!
It's so good, got her wigglin her toes (WOW!)
The boss, The-Dream
The floss, the cream
The trips overseas
All these things really don't mean a thing
When I'm tearin' that ass up, workin you like a shift
I give it to you like a gift
You hear what that boy say?
You gettin jacked, give it up fast
Then I hit it from the back
""Snoopy, you so good,"" she screamin' and I like that girl
She go off in another world, I won't stop
'til you're finished, she love this gangsta
Especially when I'm in it
Dream
[Chorus: The-Dream]
Every time I come around, shawty love me down
Run up on me like click-clack, the gun out like take that
She make it do what it do
When we doing what we doing in the back of the 'Llac
I'm like come up off of that
And every night her body get stacked
I got that gangsta, gang-gangsta
That gangsta, gang-gangsta
That gangsta, gang-gangsta
That gangsta luv
Gangsta, gang-gangsta
Gangsta, gang-gangsta
That gangsta, gang-gangsta
That gangsta luv7Embed"
